{"$id":"https://aurora.local/schemas/gtbi/v7/scientific/scientific_asset_manifest_v1.schema.json","$schema":"https://json-schema.org/draft/2020-12/schema","additionalProperties":false,"properties":{"adjustment_point_in_time_claim_allowed":{"type":"boolean"},"adjustment_policy_sha256":{"pattern":"^sha256:[0-9a-f]{64}$","type":"string"},"adjustment_temporal_model":{"enum":["as_known_each_session","retrospectively_adjusted_reference"]},"approved_hardware_profile_registry_digest":{"anyOf":[{"pattern":"^sha256:[0-9a-f]{64}$","type":"string"},{"type":"null"}]},"approved_numerical_execution_profile_registry_digest":{"anyOf":[{"pattern":"^sha256:[0-9a-f]{64}$","type":"string"},{"type":"null"}]},"artificial_truncation_manifest_digest":{"anyOf":[{"pattern":"^sha256:[0-9a-f]{64}$","type":"string"},{"type":"null"}]},"asset_manifest_digest":{"pattern":"^sha256:[0-9a-f]{64}$","type":"string"},"asset_type":{"minLength":1,"type":"string"},"attestation_reference":{"anyOf":[{"minLength":1,"type":"string"},{"type":"null"}]},"calendar_policy_sha256":{"pattern":"^sha256:[0-9a-f]{64}$","type":"string"},"campaign_id":{"minLength":1,"type":"string"},"canonical_serialization_profile_digest":{"pattern":"^sha256:[0-9a-f]{64}$","type":"string"},"causal_cross_market_claim_allowed":{"type":"boolean"},"compressed_size_bytes":{"anyOf":[{"minimum":0,"type":"integer"},{"type":"null"}]},"corporate_action_knowledge_coverage_pct":{"anyOf":[{"maximum":100,"minimum":0,"type":"number"},{"type":"null"}]},"corporate_action_knowledge_manifest_digest":{"anyOf":[{"pattern":"^sha256:[0-9a-f]{64}$","type":"string"},{"type":"null"}]},"created_at_utc":{"pattern":"^[0-9]{4}-[0-9]{2}-[0-9]{2}T[0-9]{2}:[0-9]{2}:[0-9]{2}(?:\\.[0-9]{1,9})?Z$","type":"string"},"cross_market_alignment_model":{"enum":["v6_calendar_date_reference","causal_asof_utc"]},"cross_market_temporal_contaminated":{"type":"boolean"},"currency_policy_sha256":{"pattern":"^sha256:[0-9a-f]{64}$","type":"string"},"data_digest":{"anyOf":[{"pattern":"^sha256:[0-9a-f]{64}$","type":"string"},{"type":"null"}]},"data_manifest_digest":{"anyOf":[{"pattern":"^sha256:[0-9a-f]{64}$","type":"string"},{"type":"null"}]},"decision_time_policy_digest":{"pattern":"^sha256:[0-9a-f]{64}$","type":"string"},"engine_equivalence_confirmed":{"type":"boolean"},"evaluation_identity":{"anyOf":[{"minLength":1,"type":"string"},{"type":"null"}]},"exact_universe_identity_digest":{"pattern":"^sha256:[0-9a-f]{64}$","type":"string"},"file_count":{"anyOf":[{"minimum":0,"type":"integer"},{"type":"null"}]},"final_filter_registry_digest":{"pattern":"^sha256:[0-9a-f]{64}$","type":"string"},"first_date":{"anyOf":[{"pattern":"^[0-9]{4}-[0-9]{2}-[0-9]{2}$","type":"string"},{"type":"null"}]},"first_market_session_locked":{"anyOf":[{"pattern":"^[0-9]{4}-[0-9]{2}-[0-9]{2}T[0-9]{2}:[0-9]{2}:[0-9]{2}(?:\\.[0-9]{1,9})?Z$","type":"string"},{"type":"null"}]},"first_market_session_locked_by_market_digest_or_null":{"anyOf":[{"pattern":"^sha256:[0-9a-f]{64}$","type":"string"},{"type":"null"}]},"forward_lock_calendar_manifest_digest_or_null":{"anyOf":[{"pattern":"^sha256:[0-9a-f]{64}$","type":"string"},{"type":"null"}]},"hash_domain_registry_digest":{"pattern":"^sha256:[0-9a-f]{64}$","type":"string"},"historical_adjustment_vintage_contaminated":{"type":"boolean"},"historical_causal_claim_allowed":{"type":"boolean"},"historical_exclusion_start":{"const":"2021-01-01"},"historical_execution_pack_digest":{"anyOf":[{"pattern":"^sha256:[0-9a-f]{64}$","type":"string"},{"type":"null"}]},"historical_post_validation_contaminated":{"type":"boolean"},"independent_github_disaster_asset_count":{"minimum":0,"type":"integer"},"independent_github_disaster_release_id":{"anyOf":[{"minimum":1,"type":"integer"},{"type":"null"}]},"independent_github_disaster_release_parts":{"items":{"additionalProperties":false,"properties":{"asset_id":{"minimum":1,"type":"integer"},"asset_name":{"minLength":1,"pattern":"^[A-Za-z0-9._-]+$","type":"string"},"part_index":{"minimum":0,"type":"integer"},"release_id":{"minimum":1,"type":"integer"},"repository_id":{"minimum":1,"type":"integer"},"sha256":{"pattern":"^sha256:[0-9a-f]{64}$","type":"string"},"size_bytes":{"minimum":1,"type":"integer"}},"required":["part_index","repository_id","release_id","asset_id","asset_name","size_bytes","sha256"],"type":"object"},"type":"array"},"independent_github_disaster_repository_id":{"anyOf":[{"minimum":1,"type":"integer"},{"type":"null"}]},"last_date":{"anyOf":[{"pattern":"^[0-9]{4}-[0-9]{2}-[0-9]{2}$","type":"string"},{"type":"null"}]},"later_required_approval_utc_or_null":{"anyOf":[{"pattern":"^[0-9]{4}-[0-9]{2}-[0-9]{2}T[0-9]{2}:[0-9]{2}:[0-9]{2}(?:\\.[0-9]{1,9})?Z$","type":"string"},{"type":"null"}]},"latest_restore_receipt_digest":{"anyOf":[{"pattern":"^sha256:[0-9a-f]{64}$","type":"string"},{"type":"null"}]},"locked_start":{"const":"2021-01-01"},"market_observation_availability_policy_digest":{"pattern":"^sha256:[0-9a-f]{64}$","type":"string"},"min_selection_trades_per_year":{"minimum":0,"type":"integer"},"mirror_release_asset_count":{"minimum":0,"type":"integer"},"mirror_release_id":{"anyOf":[{"minimum":1,"type":"integer"},{"type":"null"}]},"mirror_release_parts":{"items":{"additionalProperties":false,"properties":{"asset_id":{"minimum":1,"type":"integer"},"asset_name":{"minLength":1,"pattern":"^[A-Za-z0-9._-]+$","type":"string"},"part_index":{"minimum":0,"type":"integer"},"release_id":{"minimum":1,"type":"integer"},"repository_id":{"minimum":1,"type":"integer"},"sha256":{"pattern":"^sha256:[0-9a-f]{64}$","type":"string"},"size_bytes":{"minimum":1,"type":"integer"}},"required":["part_index","repository_id","release_id","asset_id","asset_name","size_bytes","sha256"],"type":"object"},"type":"array"},"mirror_release_repository_id":{"anyOf":[{"minimum":1,"type":"integer"},{"type":"null"}]},"missing_v6_dependency_layers":{"items":{"enum":["C","D0","D1","D2","D3","S","R"]},"type":"array","uniqueItems":true},"new_forward_available":{"type":"boolean"},"no_lookahead_confirmed":{"type":"boolean"},"numerical_environment_digest":{"anyOf":[{"pattern":"^sha256:[0-9a-f]{64}$","type":"string"},{"type":"null"}]},"observation_timestamp_state":{"enum":["authenticated","unknown_unverifiable"]},"optimized_vs_reference_equivalence_confirmed":{"type":"boolean"},"oracle_b_status":{"enum":["exact_match","mismatch","unavailable_missing_original_inputs"]},"platform_outage_archive_admin_negative_test_receipt_digest":{"anyOf":[{"pattern":"^sha256:[0-9a-f]{64}$","type":"string"},{"type":"null"}]},"platform_outage_archive_kms_admin_negative_test_receipt_digest_or_null":{"anyOf":[{"pattern":"^sha256:[0-9a-f]{64}$","type":"string"},{"type":"null"}]},"platform_outage_archive_kms_administrator_identity_or_null":{"anyOf":[{"minLength":1,"type":"string"},{"type":"null"}]},"platform_outage_archive_kms_deletion_protection_receipt_digest_or_null":{"anyOf":[{"pattern":"^sha256:[0-9a-f]{64}$","type":"string"},{"type":"null"}]},"platform_outage_archive_kms_provider_account_key_version_or_null":{"anyOf":[{"minLength":1,"type":"string"},{"type":"null"}]},"platform_outage_archive_kms_retain_until_utc_or_null":{"anyOf":[{"pattern":"^[0-9]{4}-[0-9]{2}-[0-9]{2}T[0-9]{2}:[0-9]{2}:[0-9]{2}(?:\\.[0-9]{1,9})?Z$","type":"string"},{"type":"null"}]},"platform_outage_archive_legal_hold_state":{"anyOf":[{"minLength":1,"type":"string"},{"type":"null"}]},"platform_outage_archive_lock_mode":{"anyOf":[{"minLength":1,"type":"string"},{"type":"null"}]},"platform_outage_archive_manifest_digest":{"anyOf":[{"pattern":"^sha256:[0-9a-f]{64}$","type":"string"},{"type":"null"}]},"platform_outage_archive_object_lock_until_utc":{"anyOf":[{"pattern":"^[0-9]{4}-[0-9]{2}-[0-9]{2}T[0-9]{2}:[0-9]{2}:[0-9]{2}(?:\\.[0-9]{1,9})?Z$","type":"string"},{"type":"null"}]},"platform_outage_archive_object_version":{"anyOf":[{"minLength":1,"type":"string"},{"type":"null"}]},"platform_outage_archive_provider":{"anyOf":[{"minLength":1,"type":"string"},{"type":"null"}]},"platform_outage_archive_retention_policy_digest":{"anyOf":[{"pattern":"^sha256:[0-9a-f]{64}$","type":"string"},{"type":"null"}]},"platform_outage_archive_server_side_encryption_mode":{"anyOf":[{"minLength":1,"type":"string"},{"type":"null"}]},"policy_hash":{"pattern":"^sha256:[0-9a-f]{64}$","type":"string"},"price_data_vintage_utc":{"anyOf":[{"pattern":"^[0-9]{4}-[0-9]{2}-[0-9]{2}T[0-9]{2}:[0-9]{2}:[0-9]{2}(?:\\.[0-9]{1,9})?Z$","type":"string"},{"type":"null"}]},"primary_release_asset_count":{"minimum":0,"type":"integer"},"primary_release_id":{"anyOf":[{"minimum":1,"type":"integer"},{"type":"null"}]},"primary_release_parts":{"items":{"additionalProperties":false,"properties":{"asset_id":{"minimum":1,"type":"integer"},"asset_name":{"minLength":1,"pattern":"^[A-Za-z0-9._-]+$","type":"string"},"part_index":{"minimum":0,"type":"integer"},"release_id":{"minimum":1,"type":"integer"},"repository_id":{"minimum":1,"type":"integer"},"sha256":{"pattern":"^sha256:[0-9a-f]{64}$","type":"string"},"size_bytes":{"minimum":1,"type":"integer"}},"required":["part_index","repository_id","release_id","asset_id","asset_name","size_bytes","sha256"],"type":"object"},"type":"array"},"primary_release_repository_id":{"anyOf":[{"minimum":1,"type":"integer"},{"type":"null"}]},"pristine_locked":{"type":"boolean"},"product":{"minLength":1,"type":"string"},"provider":{"minLength":1,"type":"string"},"provider_terms_review_id":{"anyOf":[{"minLength":1,"type":"string"},{"type":"null"}]},"reconstructed_payload_sha256":{"pattern":"^sha256:[0-9a-f]{64}$","type":"string"},"recovery_objective_policy_digest":{"anyOf":[{"pattern":"^sha256:[0-9a-f]{64}$","type":"string"},{"type":"null"}]},"reference_dependency_lock_digest":{"anyOf":[{"pattern":"^sha256:[0-9a-f]{64}$","type":"string"},{"type":"null"}]},"reference_engine_code_sha":{"anyOf":[{"pattern":"^[0-9a-f]{40}$","type":"string"},{"type":"null"}]},"reference_engine_isolation_policy_digest":{"anyOf":[{"pattern":"^sha256:[0-9a-f]{64}$","type":"string"},{"type":"null"}]},"reference_engine_tree_digest":{"anyOf":[{"pattern":"^sha256:[0-9a-f]{64}$","type":"string"},{"type":"null"}]},"reference_entrypoint_digest":{"anyOf":[{"pattern":"^sha256:[0-9a-f]{64}$","type":"string"},{"type":"null"}]},"reference_index_order_confirmed":{"type":"boolean"},"reference_runtime_digest":{"anyOf":[{"pattern":"^sha256:[0-9a-f]{64}$","type":"string"},{"type":"null"}]},"reproducibility_classification":{"enum":["fully_reproducible","result_preserved_inputs_incomplete","historical_reference_only"]},"retention_funding_manifest_digest":{"anyOf":[{"pattern":"^sha256:[0-9a-f]{64}$","type":"string"},{"type":"null"}]},"retrieval_cutoff_utc":{"pattern":"^[0-9]{4}-[0-9]{2}-[0-9]{2}T[0-9]{2}:[0-9]{2}:[0-9]{2}(?:\\.[0-9]{1,9})?Z$","type":"string"},"reuse_recovered_v6_inputs":{"type":"boolean"},"row_count":{"anyOf":[{"minimum":0,"type":"integer"},{"type":"null"}]},"schema_version":{"const":"scientific_asset_manifest_v1"},"scientific_numerical_semantics_digest":{"anyOf":[{"pattern":"^sha256:[0-9a-f]{64}$","type":"string"},{"type":"null"}]},"score_formula_manifest_digest":{"pattern":"^sha256:[0-9a-f]{64}$","type":"string"},"scoring_profile":{"anyOf":[{"minLength":1,"type":"string"},{"type":"null"}]},"selection_split":{"anyOf":[{"minLength":1,"type":"string"},{"type":"null"}]},"semantic_oracle_coverage_manifest_digest":{"anyOf":[{"pattern":"^sha256:[0-9a-f]{64}$","type":"string"},{"type":"null"}]},"semantic_oracle_effective_branch_coverage_pct":{"anyOf":[{"maximum":100,"minimum":0,"type":"number"},{"type":"null"}]},"semantic_oracle_non_equivalent_mutants_survived":{"minimum":0,"type":"integer"},"source_commit_sha":{"pattern":"^[0-9a-f]{40}$","type":"string"},"source_event_cutoff_utc":{"anyOf":[{"pattern":"^[0-9]{4}-[0-9]{2}-[0-9]{2}T[0-9]{2}:[0-9]{2}:[0-9]{2}(?:\\.[0-9]{1,9})?Z$","type":"string"},{"const":"unknown_unverifiable"}]},"source_object_sha256":{"pattern":"^sha256:[0-9a-f]{64}$","type":"string"},"source_run_id":{"minimum":1,"type":"integer"},"symbol_source_end_manifest_digest":{"anyOf":[{"pattern":"^sha256:[0-9a-f]{64}$","type":"string"},{"type":"null"}]},"synthetic_engine_equivalence_confirmed":{"type":"boolean"},"train_end":{"const":"2010-12-31"},"uncompressed_size_bytes":{"anyOf":[{"minimum":0,"type":"integer"},{"type":"null"}]},"universe_definition_sha256":{"pattern":"^sha256:[0-9a-f]{64}$","type":"string"},"universe_point_in_time_claim_allowed":{"type":"boolean"},"universe_temporal_coverage_pct":{"anyOf":[{"maximum":100,"minimum":0,"type":"number"},{"type":"null"}]},"universe_temporal_manifest_digest":{"anyOf":[{"pattern":"^sha256:[0-9a-f]{64}$","type":"string"},{"type":"null"}]},"universe_temporal_model":{"enum":["point_in_time","static_post_period"]},"v6_historical_reproduction_confirmed":{"type":"boolean"},"validation_end":{"const":"2020-12-31"},"validation_start":{"const":"2011-01-01"},"workflow_path":{"pattern":"^(?!/)(?!.*(?:^|/)\\.\\.(?:/|$))[A-Za-z0-9._/-]+$","type":"string"},"workflow_sha256":{"pattern":"^sha256:[0-9a-f]{64}$","type":"string"}},"required":["schema_version","asset_type","product","campaign_id","source_run_id","source_commit_sha","reconstructed_payload_sha256","policy_hash","workflow_path","workflow_sha256","created_at_utc","retrieval_cutoff_utc","train_end","validation_start","validation_end","locked_start","historical_exclusion_start","historical_post_validation_contaminated","pristine_locked","new_forward_available","first_market_session_locked","first_market_session_locked_by_market_digest_or_null","forward_lock_calendar_manifest_digest_or_null","later_required_approval_utc_or_null","provider","provider_terms_review_id","reproducibility_classification","evaluation_identity","selection_split","scoring_profile","min_selection_trades_per_year","score_formula_manifest_digest","final_filter_registry_digest","reuse_recovered_v6_inputs","oracle_b_status","semantic_oracle_coverage_manifest_digest","semantic_oracle_effective_branch_coverage_pct","semantic_oracle_non_equivalent_mutants_survived","v6_historical_reproduction_confirmed","synthetic_engine_equivalence_confirmed","engine_equivalence_confirmed","optimized_vs_reference_equivalence_confirmed","missing_v6_dependency_layers","universe_definition_sha256","exact_universe_identity_digest","universe_temporal_model","universe_temporal_manifest_digest","universe_temporal_coverage_pct","universe_point_in_time_claim_allowed","observation_timestamp_state","price_data_vintage_utc","source_event_cutoff_utc","adjustment_temporal_model","corporate_action_knowledge_manifest_digest","corporate_action_knowledge_coverage_pct","historical_adjustment_vintage_contaminated","adjustment_point_in_time_claim_allowed","adjustment_policy_sha256","calendar_policy_sha256","currency_policy_sha256","decision_time_policy_digest","market_observation_availability_policy_digest","cross_market_alignment_model","cross_market_temporal_contaminated","causal_cross_market_claim_allowed","reference_index_order_confirmed","no_lookahead_confirmed","historical_causal_claim_allowed","data_digest","data_manifest_digest","historical_execution_pack_digest","reference_engine_code_sha","reference_engine_tree_digest","reference_entrypoint_digest","reference_dependency_lock_digest","reference_runtime_digest","reference_engine_isolation_policy_digest","numerical_environment_digest","scientific_numerical_semantics_digest","approved_numerical_execution_profile_registry_digest","approved_hardware_profile_registry_digest","canonical_serialization_profile_digest","hash_domain_registry_digest","file_count","row_count","first_date","last_date","symbol_source_end_manifest_digest","artificial_truncation_manifest_digest","compressed_size_bytes","uncompressed_size_bytes","source_object_sha256","primary_release_repository_id","primary_release_id","primary_release_asset_count","primary_release_parts","mirror_release_repository_id","mirror_release_id","mirror_release_asset_count","mirror_release_parts","independent_github_disaster_repository_id","independent_github_disaster_release_id","independent_github_disaster_asset_count","independent_github_disaster_release_parts","platform_outage_archive_provider","platform_outage_archive_object_version","platform_outage_archive_manifest_digest","platform_outage_archive_server_side_encryption_mode","platform_outage_archive_kms_provider_account_key_version_or_null","platform_outage_archive_kms_administrator_identity_or_null","platform_outage_archive_kms_retain_until_utc_or_null","platform_outage_archive_kms_deletion_protection_receipt_digest_or_null","platform_outage_archive_kms_admin_negative_test_receipt_digest_or_null","platform_outage_archive_lock_mode","platform_outage_archive_object_lock_until_utc","platform_outage_archive_legal_hold_state","platform_outage_archive_retention_policy_digest","platform_outage_archive_admin_negative_test_receipt_digest","retention_funding_manifest_digest","recovery_objective_policy_digest","latest_restore_receipt_digest","attestation_reference","asset_manifest_digest"],"title":"GTBI V7 scientific asset compatibility manifest","type":"object","x-gtbi-digest-result-name":"asset_manifest_digest","x-gtbi-digest-storage":"self_field","x-gtbi-hash-domain-id":"GTBI_SCIENTIFIC_ASSET_MANIFEST_V1","x-gtbi-logical-schema-id":"scientific_asset_manifest_v1"}
