{"adjustment_point_in_time_claim_allowed":false,"adjustment_policy_sha256":"sha256:0000000000000000000000000000000000000000000000000000000000000000","adjustment_temporal_model":"retrospectively_adjusted_reference","approved_hardware_profile_registry_digest":null,"approved_numerical_execution_profile_registry_digest":null,"artificial_truncation_manifest_digest":null,"asset_manifest_digest":"sha256:347a120a840f2a994616819de25a1f493d63e46ba28840eb5d2dbb15360990d2","asset_type":"v6_final_result_preservation","attestation_reference":null,"calendar_policy_sha256":"sha256:0000000000000000000000000000000000000000000000000000000000000000","campaign_id":"gtbi_long_hold_fast_strict_v6","canonical_serialization_profile_digest":"sha256:0000000000000000000000000000000000000000000000000000000000000000","causal_cross_market_claim_allowed":false,"compressed_size_bytes":null,"corporate_action_knowledge_coverage_pct":null,"corporate_action_knowledge_manifest_digest":null,"created_at_utc":"2026-07-02T00:00:00Z","cross_market_alignment_model":"v6_calendar_date_reference","cross_market_temporal_contaminated":true,"currency_policy_sha256":"sha256:0000000000000000000000000000000000000000000000000000000000000000","data_digest":null,"data_manifest_digest":null,"decision_time_policy_digest":"sha256:0000000000000000000000000000000000000000000000000000000000000000","engine_equivalence_confirmed":false,"evaluation_identity":null,"exact_universe_identity_digest":"sha256:0000000000000000000000000000000000000000000000000000000000000000","file_count":null,"final_filter_registry_digest":"sha256:0000000000000000000000000000000000000000000000000000000000000000","first_date":null,"first_market_session_locked":null,"first_market_session_locked_by_market_digest_or_null":null,"forward_lock_calendar_manifest_digest_or_null":null,"hash_domain_registry_digest":"sha256:0000000000000000000000000000000000000000000000000000000000000000","historical_adjustment_vintage_contaminated":true,"historical_causal_claim_allowed":false,"historical_exclusion_start":"2021-01-01","historical_execution_pack_digest":null,"historical_post_validation_contaminated":true,"independent_github_disaster_asset_count":0,"independent_github_disaster_release_id":null,"independent_github_disaster_release_parts":[],"independent_github_disaster_repository_id":null,"last_date":null,"later_required_approval_utc_or_null":null,"latest_restore_receipt_digest":null,"locked_start":"2021-01-01","market_observation_availability_policy_digest":"sha256:0000000000000000000000000000000000000000000000000000000000000000","min_selection_trades_per_year":0,"mirror_release_asset_count":0,"mirror_release_id":null,"mirror_release_parts":[],"mirror_release_repository_id":null,"missing_v6_dependency_layers":["C","D0","D1","D2","D3","S"],"new_forward_available":false,"no_lookahead_confirmed":false,"numerical_environment_digest":null,"observation_timestamp_state":"unknown_unverifiable","optimized_vs_reference_equivalence_confirmed":false,"oracle_b_status":"unavailable_missing_original_inputs","platform_outage_archive_admin_negative_test_receipt_digest":null,"platform_outage_archive_kms_admin_negative_test_receipt_digest_or_null":null,"platform_outage_archive_kms_administrator_identity_or_null":null,"platform_outage_archive_kms_deletion_protection_receipt_digest_or_null":null,"platform_outage_archive_kms_provider_account_key_version_or_null":null,"platform_outage_archive_kms_retain_until_utc_or_null":null,"platform_outage_archive_legal_hold_state":null,"platform_outage_archive_lock_mode":null,"platform_outage_archive_manifest_digest":null,"platform_outage_archive_object_lock_until_utc":null,"platform_outage_archive_object_version":null,"platform_outage_archive_provider":null,"platform_outage_archive_retention_policy_digest":null,"platform_outage_archive_server_side_encryption_mode":null,"policy_hash":"sha256:0000000000000000000000000000000000000000000000000000000000000000","price_data_vintage_utc":null,"primary_release_asset_count":0,"primary_release_id":null,"primary_release_parts":[],"primary_release_repository_id":null,"pristine_locked":false,"product":"GTBI Fast Strict V6","provider":"GitHub Actions artifact service","provider_terms_review_id":null,"reconstructed_payload_sha256":"sha256:870ab8a0ded260b7761b7c706c239c4fce712d2fd7f7c8fb1d41dc1dffedda5b","recovery_objective_policy_digest":null,"reference_dependency_lock_digest":null,"reference_engine_code_sha":"cb80c5065c127322a303d58aea0f6c05337a6c9e","reference_engine_isolation_policy_digest":null,"reference_engine_tree_digest":null,"reference_entrypoint_digest":null,"reference_index_order_confirmed":false,"reference_runtime_digest":null,"reproducibility_classification":"result_preserved_inputs_incomplete","retention_funding_manifest_digest":null,"retrieval_cutoff_utc":"2026-07-29T12:41:00Z","reuse_recovered_v6_inputs":false,"row_count":null,"schema_version":"scientific_asset_manifest_v1","scientific_numerical_semantics_digest":null,"score_formula_manifest_digest":"sha256:0000000000000000000000000000000000000000000000000000000000000000","scoring_profile":null,"selection_split":null,"semantic_oracle_coverage_manifest_digest":null,"semantic_oracle_effective_branch_coverage_pct":null,"semantic_oracle_non_equivalent_mutants_survived":0,"source_commit_sha":"cb80c5065c127322a303d58aea0f6c05337a6c9e","source_event_cutoff_utc":"unknown_unverifiable","source_object_sha256":"sha256:870ab8a0ded260b7761b7c706c239c4fce712d2fd7f7c8fb1d41dc1dffedda5b","source_run_id":29162930823,"symbol_source_end_manifest_digest":null,"synthetic_engine_equivalence_confirmed":false,"train_end":"2010-12-31","uncompressed_size_bytes":null,"universe_definition_sha256":"sha256:0000000000000000000000000000000000000000000000000000000000000000","universe_point_in_time_claim_allowed":false,"universe_temporal_coverage_pct":null,"universe_temporal_manifest_digest":null,"universe_temporal_model":"static_post_period","v6_historical_reproduction_confirmed":false,"validation_end":"2020-12-31","validation_start":"2011-01-01","workflow_path":".github/workflows/global-technical-buy-indicator-long-hold-fast-strict-v6.yml","workflow_sha256":"sha256:0000000000000000000000000000000000000000000000000000000000000000"}
