{"adjustment_point_in_time_claim_allowed":false,"adjustment_policy_sha256":"sha256:0000000000000000000000000000000000000000000000000000000000000000","adjustment_temporal_model":"retrospectively_adjusted_reference","approved_hardware_profile_registry_digest":null,"approved_numerical_execution_profile_registry_digest":null,"artificial_truncation_manifest_digest":null,"asset_manifest_digest":"sha256:e581450d23b2f480b27b14c1e2f20f6ce3867c3e5e26efd203ba3d118ef12bfe","asset_type":"v6_final_result_preservation","attestation_reference":"docs/readiness/gtbi-v7/v6_durable_preservation_receipt.json","calendar_policy_sha256":"sha256:0000000000000000000000000000000000000000000000000000000000000000","campaign_id":"gtbi_long_hold_fast_strict_v6","canonical_serialization_profile_digest":"sha256:0000000000000000000000000000000000000000000000000000000000000000","causal_cross_market_claim_allowed":false,"compressed_size_bytes":1962204087,"corporate_action_knowledge_coverage_pct":null,"corporate_action_knowledge_manifest_digest":null,"created_at_utc":"2026-07-11T18:09:30Z","cross_market_alignment_model":"v6_calendar_date_reference","cross_market_temporal_contaminated":true,"currency_policy_sha256":"sha256:0000000000000000000000000000000000000000000000000000000000000000","data_digest":"sha256:e0552ac354766a4af28fcb77a867f63f9da646fb4b89c8c11c36cd6071275c5e","data_manifest_digest":"sha256:4df3dc479386e2dfd4e89d53e2026760091f71afe98847ad44a2793081857707","decision_time_policy_digest":"sha256:0000000000000000000000000000000000000000000000000000000000000000","engine_equivalence_confirmed":false,"evaluation_identity":null,"exact_universe_identity_digest":"sha256:0000000000000000000000000000000000000000000000000000000000000000","file_count":47,"final_filter_registry_digest":"sha256:0000000000000000000000000000000000000000000000000000000000000000","first_date":"1962-01-02","first_market_session_locked":null,"first_market_session_locked_by_market_digest_or_null":null,"forward_lock_calendar_manifest_digest_or_null":null,"hash_domain_registry_digest":"sha256:0000000000000000000000000000000000000000000000000000000000000000","historical_adjustment_vintage_contaminated":true,"historical_causal_claim_allowed":false,"historical_exclusion_start":"2021-01-01","historical_execution_pack_digest":"sha256:e0552ac354766a4af28fcb77a867f63f9da646fb4b89c8c11c36cd6071275c5e","historical_post_validation_contaminated":false,"independent_github_disaster_asset_count":0,"independent_github_disaster_release_id":null,"independent_github_disaster_release_parts":[],"independent_github_disaster_repository_id":null,"last_date":"2020-12-31","later_required_approval_utc_or_null":null,"latest_restore_receipt_digest":"sha256:0eff5ed41f8cc4e1232a3c2354ea66259b235c4616481fbfb2d574d052687196","locked_start":"2021-01-01","market_observation_availability_policy_digest":"sha256:0000000000000000000000000000000000000000000000000000000000000000","min_selection_trades_per_year":0,"mirror_release_asset_count":1,"mirror_release_id":362325841,"mirror_release_parts":[{"asset_id":495309999,"asset_name":"global-technical-buy-indicator-long-hold-fast-strict-v6-results.zip","part_index":0,"release_id":362325841,"repository_id":1317082575,"sha256":"sha256:870ab8a0ded260b7761b7c706c239c4fce712d2fd7f7c8fb1d41dc1dffedda5b","size_bytes":1962204087}],"mirror_release_repository_id":1317082575,"missing_v6_dependency_layers":["D0","D1","D2"],"new_forward_available":false,"no_lookahead_confirmed":false,"numerical_environment_digest":null,"observation_timestamp_state":"unknown_unverifiable","optimized_vs_reference_equivalence_confirmed":false,"oracle_b_status":"unavailable_missing_original_inputs","platform_outage_archive_admin_negative_test_receipt_digest":null,"platform_outage_archive_kms_admin_negative_test_receipt_digest_or_null":null,"platform_outage_archive_kms_administrator_identity_or_null":null,"platform_outage_archive_kms_deletion_protection_receipt_digest_or_null":null,"platform_outage_archive_kms_provider_account_key_version_or_null":null,"platform_outage_archive_kms_retain_until_utc_or_null":null,"platform_outage_archive_legal_hold_state":null,"platform_outage_archive_lock_mode":null,"platform_outage_archive_manifest_digest":null,"platform_outage_archive_object_lock_until_utc":null,"platform_outage_archive_object_version":null,"platform_outage_archive_provider":null,"platform_outage_archive_retention_policy_digest":null,"platform_outage_archive_server_side_encryption_mode":null,"policy_hash":"sha256:0000000000000000000000000000000000000000000000000000000000000000","price_data_vintage_utc":null,"primary_release_asset_count":1,"primary_release_id":362325816,"primary_release_parts":[{"asset_id":495309998,"asset_name":"global-technical-buy-indicator-long-hold-fast-strict-v6-results.zip","part_index":0,"release_id":362325816,"repository_id":1317002870,"sha256":"sha256:870ab8a0ded260b7761b7c706c239c4fce712d2fd7f7c8fb1d41dc1dffedda5b","size_bytes":1962204087}],"primary_release_repository_id":1317002870,"pristine_locked":true,"product":"GTBI Fast Strict V6","provider":"GitHub Actions artifact service","provider_terms_review_id":"github-private-release-owner-accepted-2026-07-30","reconstructed_payload_sha256":"sha256:870ab8a0ded260b7761b7c706c239c4fce712d2fd7f7c8fb1d41dc1dffedda5b","recovery_objective_policy_digest":"sha256:bc26f38bf863a4bdd49a51258bf162274cdab3d702c3f13950e9b5025f4a8ad8","reference_dependency_lock_digest":"sha256:e0ebac1931c2cb66686b8adbf9262d89c177ad1e75af822f83a323199fa763e6","reference_engine_code_sha":"e8186189fe52e879471941acdadd94004a0662f6","reference_engine_isolation_policy_digest":null,"reference_engine_tree_digest":null,"reference_entrypoint_digest":null,"reference_index_order_confirmed":false,"reference_runtime_digest":null,"reproducibility_classification":"result_preserved_inputs_incomplete","retention_funding_manifest_digest":null,"retrieval_cutoff_utc":"2026-07-30T11:57:22Z","reuse_recovered_v6_inputs":false,"row_count":null,"schema_version":"scientific_asset_manifest_v1","scientific_numerical_semantics_digest":null,"score_formula_manifest_digest":"sha256:0000000000000000000000000000000000000000000000000000000000000000","scoring_profile":null,"selection_split":null,"semantic_oracle_coverage_manifest_digest":null,"semantic_oracle_effective_branch_coverage_pct":null,"semantic_oracle_non_equivalent_mutants_survived":0,"source_commit_sha":"cb80c5065c127322a303d58aea0f6c05337a6c9e","source_event_cutoff_utc":"unknown_unverifiable","source_object_sha256":"sha256:870ab8a0ded260b7761b7c706c239c4fce712d2fd7f7c8fb1d41dc1dffedda5b","source_run_id":29162930823,"symbol_source_end_manifest_digest":null,"synthetic_engine_equivalence_confirmed":false,"train_end":"2010-12-31","uncompressed_size_bytes":5770916655,"universe_definition_sha256":"sha256:0000000000000000000000000000000000000000000000000000000000000000","universe_point_in_time_claim_allowed":false,"universe_temporal_coverage_pct":null,"universe_temporal_manifest_digest":null,"universe_temporal_model":"static_post_period","v6_historical_reproduction_confirmed":false,"validation_end":"2020-12-31","validation_start":"2011-01-01","workflow_path":".github/workflows/global-technical-buy-indicator-external-pack-360jobs.yml","workflow_sha256":"sha256:87e98bc51999eaa03aeb402bc98b0438860c224bf49937605a73a16901f0784f"}
